{
  "dataset_class": "PUBLIC_KB",
  "synthetic": false,
  "rate_quote_id": "quote:kb-seller-loan:c0a4d61023eb58e5a60733795c863a71",
  "observation_id": "obs:kb-seller-loan:bfb9f700adf85398bf41bb7c87e758bb",
  "product_key": "kb-seller-loan",
  "advertised_rate_text": "연 3.85% (쿠팡셀러 기준) (자동선정산 우대금리 0.5%p 적용 시)",
  "advertised_rate_reference_date": null,
  "text_locator": {
    "strategy": "LABELED_ADJACENT_TEXT",
    "selector": "span.info_tit + span.info_txt",
    "label": "적용금리",
    "evidence_text": "연 3.85% (쿠팡셀러 기준) (자동선정산 우대금리 0.5%p 적용 시)",
    "evidence_hash": "sha256:196e494618fe2cca220468f86eaf29462a5d7603c6314fa71b8294613e450f69",
    "snapshot_hash": "sha256:def6b5b670fc0adf36909ffd1ce47bd416a67e213f7127b5058c44681fe7e44b",
    "source_url": "https://zloan.kbstar.com/quics?page=C108424"
  },
  "reference_date_locator": null
}
